"Amélie Nothomb /ameli nɔtɔ̃b/, nom de plume de Fabienne Claire Nothomb, née le 9 juillet 1966 à Etterbeek (Région de Bruxelles-Capitale), est une romancière belge d'expression française.
Auteur prolifique, elle publie un ouvrage par an depuis son premier roman, Hygiène de l'assassin (1992). Ses romans font partie des meilleures ventes littéraires et certains sont traduits en plusieurs langues.
Ce succès lui vaut d'avoir été nommée commandeur de l'ordre de la Couronne et, sur la proposition du Vice-Premier Ministre et Ministre des Affaires étrangères, le Roi Philippe lui a accordé concession du titre personnel de baronne. Son roman Stupeur et Tremblements a remporté en 1999 le Grand prix du roman de l'Académie française.
En 2015, elle est élue membre de l'Académie royale de langue et de littérature françaises de Belgique."
"Victor Hugo est un poète, dramaturge, écrivain, romancier et dessinateur romantique français, né le 26 février 1802 (7 ventôse an X selon le calendrier républicain encore en vigueur) à Besançon et mort le 22 mai 1885 à Paris. Il est considéré comme l'un des plus importants écrivains de langue française. Il est aussi une personnalité politique et un intellectuel engagé qui a eu un rôle  idéologique majeur et occupe une place marquante dans l'histoire des lettres françaises au XIXe siècle, dans des genres et des domaines d’une remarquable variété,. 
Au théâtre, Victor Hugo se manifeste comme un des chefs de file du Romantisme français lorsqu'il expose sa théorie du drame romantique dans les préfaces qui introduisent Cromwell en 1827, puis Hernani en 1830 qui sont de véritables manifestes, puis par ses autres œuvres dramatiques : Ruy Blas en 1838, mais aussi Lucrèce Borgia et Le Roi s'amuse.
Victor Hugo est aussi un poète lyrique avec des recueils comme Odes et Ballades (1826), Les Feuilles d'automne (1831) ou Les Contemplations (1856), mais il est aussi poète engagé contre Napoléon III dans Les Châtiments (1853) ou encore poète épique avec La Légende des siècles (1859 et 1877).
Ses romans rencontrent également un grand succès populaire, avec notamment Notre-Dame de Paris (1831), et plus encore avec Les Misérables (1862). 
Son œuvre multiple comprend aussi des discours politiques à la Chambre des pairs, à l'Assemblée constituante et à l'Assemblée législative, notamment sur la peine de mort, l’école ou l’Europe, des récits de voyages (Le Rhin, 1842, ou Choses vues, posthumes, 1887 et 1890), une correspondance abondante, ainsi que de nombreux croquis et dessins à la plume et au lavis.
Victor Hugo a fortement contribué au renouvellement de la poésie et du théâtre. Il a été admiré par ses contemporains et l’est encore, mais il a aussi été contesté par certains auteurs modernes. Il a permis à de nombreuses générations de développer une réflexion sur l’engagement de l’écrivain dans la vie politique et sociale grâce à ses multiples prises de position, choisissant de s'exiler pour vivre à Guernesey pendant les vingt ans du Second Empire.
Ses choix, à la fois moraux et politiques, durant la deuxième partie de sa vie, et son œuvre hors du commun ont fait de lui un personnage emblématique, que la Troisième République a honoré par des funérailles nationales, qui ont accompagné le transfert de sa dépouille au Panthéon de Paris le 1er juin 1885, dix jours après sa mort."
"John Ernst Steinbeck, Jr. (en anglais : [ˈstaɪnbɛk]), né le 27 février 1902 à Salinas aux États-Unis et mort le 20 décembre 1968 à New York aux États-Unis) est un écrivain américain. 
Il remporte le prix Nobel de littérature en 1962 « pour ses écrits réalistes et imaginatifs, alliant à la fois un humour sympathique et une perception sociale aiguë ». On le considère comme « un géant des lettres américaines » et plusieurs de ses œuvres sont des classiques de la littérature occidentale.
Au cours de sa carrière, il publie 27 livres, dont 16 romans, six livres non romanesques et deux recueils de nouvelles. Il est largement connu pour les romans comiques Tortilla Flat (1935) et Rue de la sardine (1945), la saga familiale À l'est d'Éden (1952), ainsi que pour les courts romans Des souris et des hommes (1937) et Le Poney rouge (1937). Les Raisins de la colère (1939), lauréat du prix Pulitzer, est considéré comme son chef-d'œuvre et fait partie du Western canon (en). Au cours des 75 années qui ont suivi sa publication, il s'est vendu à plus de 14 millions d'exemplaires.
La plupart des oeuvres de Steinbeck se déroulent au cœur de la Californie, en particulier dans la vallée de Salinas et les chaînes côtières californiennes. Ses œuvres ont fréquemment exploré les thèmes du destin et de l'injustice, en particulier chez les travailleurs et fermiers opprimés."
"Aldous Leonard Huxley, né le 26 juillet 1894 à Godalming (Royaume-Uni) et mort le 22 novembre 1963 à Los Angeles (États-Unis), est un écrivain, romancier et philosophe britannique, membre éminent de la famille Huxley. Il est diplômé du Balliol College de l'Université d'Oxford avec une mention très bien en littérature anglaise.
Auteur de près de cinquante ouvrages, il est surtout connu pour ses romans, dont Le Meilleur des mondes roman d’anticipation dystopique ; pour des ouvrages non romanesques, comme Les Portes de la perception qui retrace les expériences vécues lors de la prise de drogue psychédélique ; et pour un large éventail d'essais. Au début de sa carrière, Huxley a dirigé le magazine Oxford Poetry et publié des nouvelles et des poésies.
Au milieu de sa carrière et plus tard, il a publié des récits de voyage et des scénarios cinématographiques. Il a passé la dernière partie de sa vie aux États-Unis, vivant à Los Angeles de 1937 jusqu'à sa mort. En 1962, un an avant sa mort, il est élu Compagnon de littérature par la Royal Society of Literature.
Huxley était humaniste, pacifiste et satiriste. Il s'est également intéressé à des sujets spirituels tels que la parapsychologie et le mysticisme philosophique, en particulier l'universalisme. Vers la fin de sa vie, Huxley fut largement reconnu comme l'un des intellectuels prééminents de son temps. Il a été nommé sept fois pour le Prix Nobel de littérature,,,."
"Muriel Barbery, née le 28 mai 1969  à Casablanca (Maroc), est une romancière française."
"Henry-René-Albert-Guy de Maupassant  [gi d(ə) mo.pa.ˈsɑ̃] est un écrivain et journaliste littéraire français né le 5 août 1850 au château de Miromesnil à Tourville-sur-Arques, (Seine-Inférieure) et mort le 6 juillet 1893 à Paris.
Lié à Gustave Flaubert et à Émile Zola, Maupassant a marqué la littérature française par ses six romans, dont Une vie en 1883, Bel-Ami en  1885, Pierre et Jean en 1887-1888, et surtout par ses nouvelles (parfois intitulées contes) comme Boule de suif en 1880, les Contes de la bécasse (1883) ou Le Horla (1887). Ces œuvres retiennent l’attention par leur force réaliste, la présence importante du fantastique et par le pessimisme qui s’en dégage le plus souvent, mais aussi par la maîtrise stylistique. La carrière littéraire de Maupassant se limite à une décennie — de 1880 à 1890 — avant qu’il ne sombre peu à peu dans la folie et ne meure peu avant ses quarante-trois ans. Reconnu de son vivant, il conserve un renom de premier plan, renouvelé encore par les nombreuses adaptations filmées de ses œuvres."
"Bernard Werber (prononcer /vɛʁbɛʁ/), né le 18 septembre 1961 à Toulouse, est un écrivain français. Il est principalement connu pour sa trilogie des Fourmis. 
Son œuvre, traduite dans une trentaine de langues, fait se rencontrer spiritualité, science-fiction, polar, biologie, mythologie, etc. L'auteur qualifie parfois son style de « philosophie-fiction »."
"Suzanne Collins, née le 10 août 1962 à Hartford dans le Connecticut, est une écrivaine américaine. Elle a connu le succès grâce à la trilogie de science-fiction The Hunger Games, bien qu'ayant écrit plusieurs livres de fantasy auparavant."
"Albert Camus, né le 7 novembre 1913 à Mondovi (aujourd’hui Dréan), près de Bône (aujourd’hui Annaba), en Algérie, et mort accidentellement le 4 janvier 1960 à Villeblevin, dans l'Yonne en France, est un écrivain, philosophe, romancier, dramaturge, journaliste, essayiste et nouvelliste français. Il est aussi journaliste militant engagé dans la Résistance française et, proche des courants libertaires,,, dans les combats moraux de l'après-guerre.
Son œuvre comprend des pièces de théâtre, des romans, des nouvelles, des films, des poèmes et des essais dans lesquels il développe un humanisme fondé sur la prise de conscience de l'absurde de la condition humaine mais aussi sur la révolte comme réponse à l'absurde, révolte qui conduit à l'action et donne un sens au monde et à l'existence, et « alors naît la joie étrange qui aide à vivre et mourir ». Il reçoit le prix Nobel de littérature en 1957.
Dans le journal Combat, ses prises de position sont audacieuses, aussi bien sur la question de l'indépendance de l'Algérie que sur ses rapports avec le Parti communiste français, qu'il quitte après un court passage de deux ans.
Il ne se dérobe devant aucun combat, protestant successivement contre les inégalités qui frappent les musulmans d'Afrique du Nord, puis contre la caricature du pied-noir exploiteur, ou prenant la défense des Espagnols exilés antifascistes, des victimes du stalinisme et des objecteurs de conscience.
En marge des courants philosophiques, Camus est d'abord témoin de son temps, refusant toute compromission. Il n'a cessé de lutter contre toutes les idéologies et les abstractions qui détournent de l'humain. Il est ainsi amené à s'opposer à l'existentialisme et au marxisme, sa critique du totalitarisme soviétique lui vaut les anathèmes de communistes et sa rupture avec Jean-Paul Sartre."
"René Barjavel, né le 24 janvier 1911 à Nyons (Drôme) et mort le 24 novembre 1985 à Paris, est un écrivain et journaliste français, également scénariste et dialoguiste de cinéma. Il est principalement connu pour ses romans d'anticipation, de science-fiction ou fantastique dans lesquels s'exprime l'angoisse ressentie devant une technologie que l'être humain ne maîtrise plus.
Certains thèmes reviennent fréquemment dans son œuvre littéraire : chute de la civilisation causée par les excès de la science et la folie de la guerre, caractère éternel et indestructible de l'amour (Ravage, La Nuit des temps, Le Grand Secret, Une rose au paradis). Son écriture se veut poétique, onirique et, parfois, philosophique. Il a aussi abordé dans ses essais l'interrogation empirique et poétique sur l'existence de Dieu (notamment, La Faim du tigre), et le sens de l'action de l'être humain sur la nature."
"Emily Jane Brontë /ˈɛməli d͡ʒeɪn ˈbɹɒnteɪ/, (30 juillet 1818 Thornton – 19 décembre 1848 Haworth) est une poétesse et romancière britannique, sœur de Charlotte Brontë et d'Anne Brontë. Les Hauts de Hurlevent (Wuthering Heights), son unique roman, est considéré comme un classique de la littérature anglaise et mondiale.
Très proche de sa sœur Anne, au point qu'on les a comparées à des jumelles, elle participe avec elle au cycle de Gondal. Emily est l'autrice de nombreux poèmes de grande qualité, dont une part importante a été écrite dans le cadre du Gondal."
"Alain-Fournier, pseudonyme d'Henri-Alban Fournier, né le 3 octobre 1886 à La Chapelle-d'Angillon dans le Cher et tué au combat le 22 septembre 1914 (à 27 ans) à Saint-Remy-la-Calonne, est un écrivain français, dont l’œuvre la plus célèbre est Le Grand Meaulnes (1913)."
"Oscar Wilde /ˈɒskə waɪld/, dont le nom complet est Oscar Fingal O'Flahertie Wills Wilde, est un écrivain, romancier, dramaturge et poète irlandais né à Dublin le 16 octobre 1854 et mort à Paris le 30 novembre 1900.
Né dans la bourgeoisie irlandaise et protestante de Dublin d’un père chirurgien renommé et d’une mère poétesse, Oscar Wilde se distingue par un parcours scolaire brillant. Nourri de culture classique, couronné de prix au sein du Trinity College de Dublin, il intègre le Magdalen College de l'université d'Oxford, où il se construit un personnage d’esthète et de dandy, sous l’influence des préraphaélites et des théories de L'art pour l'art de Walter Pater, John Ruskin et Whistler. À l’issue de ses études, il s’installe à Londres, où il parvient à s'insérer dans la bonne société et les cercles cultivés, s’illustrant dans plusieurs genres littéraires.
S’il publie, conformément aux exigences de l’esthétisme le plus pur, un volume de poésie, il ne néglige pas des activités moins considérées des cercles littéraires, mais plus lucratives : ainsi, il se fait le porte-parole de la nouvelle « Renaissance anglaise dans les arts » dans une série de conférences aux États-Unis et au Canada, puis exerce une prolifique activité de journaliste. Au tournant des années 1890, il précise sa théorie esthétique dans une série de dialogues et d’essais, et explore dans son roman Le Portrait de Dorian Gray (1890) les liens entretenus par la beauté, la décadence et la duplicité. Sa pièce Salomé (1891), rédigée en français à Paris l’année suivante, ne peut être jouée en Angleterre, faute d’avoir obtenu la licence d’autorisation au motif qu’elle met en scène des personnages bibliques. Confronté une première fois aux rigueurs de la morale victorienne, Oscar Wilde enchaîne cependant avec quatre comédies de mœurs qui font de lui l’un des dramaturges les plus en vue de Londres. Indissociables de son talent littéraire, sa personnalité hors du commun, son esprit mordant, sa conversation brillante et ses costumes assuraient sa renommée.
Au faîte de la gloire, alors que sa pièce maîtresse L'Importance d'être constant (1895) triomphe à Londres, Oscar Wilde poursuit le père de son amant Alfred Douglas pour diffamation, après que celui-ci a entrepris de faire scandale de son homosexualité. Au terme de trois procès retentissants, Oscar Wilde est condamné pour « grave immoralité » à deux ans de travaux forcés. Ruiné par ses différents procès et condamné à la banqueroute, il écrit en prison De Profundis, une longue lettre adressée à son amant dont la noirceur forme un contraste saisissant avec sa première philosophie du plaisir. Dès sa libération en mai 1897, il quitte définitivement la Grande-Bretagne pour la France. C’est dans ce pays d’accueil qu’il met un point final à son œuvre avec La Ballade de la geôle de Reading (1898), un long poème commémorant l’expérience éprouvante de la vie en prison. Il meurt à Paris en 1900, dans le dénuement, à l'âge de quarante-six ans."
"Joël Dicker, né à Genève le 16 juin 1985, est un écrivain suisse romand."
"Katherine Pancol, née le 22 octobre 1954 à Casablanca au Maroc, est une journaliste et romancière française."
"Stieg Larsson, de son nom complet Karl Stig-Erland Larsson, né le 15 août 1954 à Skelleftehamn, dans la région de Västerbotten et mort le 9 novembre 2004 à Stockholm d'une crise cardiaque, est un journaliste et écrivain suédois connu pour son engagement contre l'extrémisme de droite et le racisme. Publiée à titre posthume entre 2005 et 2008, sa trilogie Millénium le rend mondialement célèbre."
"Jane Austen [ˈd͡ʒeɪn ˈɒstɪn], née le 16 décembre 1775 à Steventon, dans le Hampshire en Angleterre, et morte le 18 juillet 1817 à Winchester, dans le même comté, est une femme de lettres anglaise.
Son réalisme, sa critique sociale mordante et sa maîtrise du discours indirect libre, son humour décalé et son ironie ont fait d'elle l'un des écrivains anglais les plus largement lus et aimés.
Toute sa vie, Jane Austen demeure au sein d'une cellule familiale étroitement unie, appartenant à la petite gentry anglaise. Elle doit son éducation en grande partie à son père et à ses frères aînés, ainsi qu'à ses propres lectures. Le soutien sans faille de sa famille est essentiel pour son évolution en tant qu'écrivaine professionnelle,. L'apprentissage artistique de Jane Austen s'étend du début de son adolescence jusqu'à sa vingt-cinquième année environ. Durant cette période, elle s'essaie à différentes formes littéraires, y compris le roman épistolaire qu'elle expérimente avant de l'abandonner, et écrit et retravaille profondément trois romans majeurs, tout en en commençant un quatrième.
De 1811 à 1816, avec la parution de Sense and Sensibility (publié de façon anonyme en 1811), Pride and Prejudice (1813), Mansfield Park (1814) et Emma (1816), elle connaît le succès. Deux autres romans, Northanger Abbey (achevé en fait dès 1803) et Persuasion, font tous deux l'objet d'une publication posthume en 1818 ; en janvier 1817, elle commence son dernier roman, finalement intitulé Sanditon, qu'elle ne peut achever avant sa mort.
L'œuvre de Jane Austen est, entre autres, une critique des romans sentimentaux de la seconde moitié du XVIIIe siècle et appartient à la transition qui conduit au réalisme littéraire du XIXe. Les intrigues de Jane Austen, bien qu'essentiellement de nature comique, c'est-à-dire avec un dénouement heureux, mettent en lumière la dépendance des femmes à l'égard du mariage pour obtenir statut social et sécurité économique,. Comme Samuel Johnson, l'une de ses influences majeures, elle s'intéresse particulièrement aux questions morales,.
Du fait de l'anonymat qu'elle cherche à préserver, sa réputation est modeste de son vivant, avec quelques critiques favorables. Au XIXe siècle, ses romans ne sont admirés que par l'élite littéraire. Cependant, la parution en 1869 de A Memoir of Jane Austen (Souvenir de Jane Austen), écrit par son neveu, la fait connaître d'un public plus large. On découvre alors une personnalité attirante, et, du coup, l'intérêt populaire pour ses œuvres prend son essor. Depuis les années 1940, Jane Austen est largement reconnue sur le plan académique comme « grand écrivain anglais ». Durant la seconde moitié du XXe siècle, se multiplient les recherches sur ses romans, qui sont analysés sous divers aspects, par exemple artistique, idéologique ou historique. Peu à peu, la culture populaire s'empare de Jane Austen et les adaptations cinématographiques ou télévisuelles qui sont réalisées sur sa vie ou ses romans connaissent un réel succès.
Il est généralement admis que l'œuvre de Jane Austen appartient non seulement au patrimoine littéraire de la Grande-Bretagne et des pays anglophones, mais aussi à la littérature mondiale. Elle fait aujourd'hui, comme les Brontë, l'objet d'un culte, mais de nature différente : Jane Austen jouit en effet d'une popularité quasi universelle et qui croît de façon exponentielle. On estime à plus de 600 les adaptations actuelles d'œuvres de cette écrivaine, dont une grande majorité en Chine (depuis 2012).
Jane Austen écrivait souvent pour sa famille, en particulier pour ses frères, diplômés à l'université d'Oxford. Malgré le haut niveau littéraire de sa famille, Jane fut la seule à devenir une écrivaine publiée."
"Honoré de Balzac, né Honoré Balzac à Tours le 20 mai 1799 (1er prairial an VII du calendrier républicain) et mort à Paris le 18 août 1850 (à 51 ans), est un écrivain français. Romancier, dramaturge, critique littéraire, critique d'art, essayiste, journaliste et imprimeur, il a laissé l'une des plus imposantes œuvres romanesques de la littérature française, avec plus de quatre-vingt-dix romans et nouvelles parus de 1829 à 1855, réunis sous le titre La Comédie humaine. À cela s'ajoutent Les Cent Contes drolatiques, ainsi que des romans de jeunesse publiés sous des pseudonymes et quelque vingt-cinq œuvres ébauchées.
Il est un maître du roman français, dont il a abordé plusieurs genres, du roman philosophique avec Le Chef-d'œuvre inconnu au roman fantastique avec La Peau de chagrin ou encore au roman poétique avec Le Lys dans la vallée. Il a surtout excellé dans la veine du réalisme, avec notamment Le Père Goriot et Eugénie Grandet, mais il s'agit d'un réalisme visionnaire, que transcende la puissance de son imagination créatrice.
Comme il l'explique dans son avant-propos à La Comédie humaine, il a pour projet d'identifier les « espèces sociales » de son époque, tout comme Buffon avait identifié les espèces zoologiques. Ayant découvert par ses lectures de Walter Scott que le roman pouvait atteindre à une « valeur philosophique », il veut explorer les différentes classes sociales et les individus qui les composent, afin d' « écrire l'histoire oubliée par tant d'historiens, celle des mœurs » et « faire concurrence à l'état civil ».
L'auteur décrit la montée du capitalisme et l'absorption par la bourgeoisie d'une noblesse incapable de s'adapter aux réalités nouvelles. Intéressé par les êtres qui ont un destin, il crée des personnages plus grands que nature : « Chacun, chez Balzac, même les portières, a du génie. » (Baudelaire)
Ses opinions politiques sont ambiguës : s'il affiche des convictions légitimistes en pleine monarchie de Juillet, il s'est auparavant déclaré libéral et défendra les ouvriers en 1840 et en 1848, même s'il ne leur accorde aucune place dans ses romans. Tout en professant des idées conservatrices, il a produit une œuvre admirée par Marx et Engels, et qui invite par certains aspects à l'anarchisme et à la révolte.
Outre sa production littéraire, il écrit des articles dans les journaux et dirige successivement deux revues, qui feront faillite. Convaincu de la haute mission de l'écrivain, qui doit régner par la pensée, il lutte pour le respect des droits d'auteur et contribue à la fondation de la Société des gens de lettres.
Travailleur forcené, fragilisant par ses excès une santé précaire, endetté à la suite d'investissements hasardeux et de dépenses somptuaires, fuyant ses créanciers sous de faux noms dans différentes demeures, Balzac a aussi eu de nombreuses liaisons féminines avant d'épouser, en 1850, la comtesse Hańska, qu'il avait courtisée pendant dix-sept ans. Comme l'argent qu'il gagnait avec sa plume ne suffisait pas à payer ses dettes, il avait sans cesse en tête des projets mirobolants : une imprimerie, un journal, une mine d'argent. C'est dans un palais situé rue Fortunée qu'il meurt profondément endetté au milieu d'un luxe inouï.
Lu et admiré dans toute l'Europe, Balzac a fortement influencé les écrivains de son temps et du siècle suivant. Le roman L'Éducation sentimentale de Gustave Flaubert est directement inspiré du Lys dans la vallée, et Madame Bovary, de La Femme de trente ans. Le principe du retour de personnages évoluant et se transformant au sein d'un vaste cycle romanesque a notamment inspiré Émile Zola et Marcel Proust. Ses œuvres continuent d'être rééditées. Le cinéma a adapté La Marâtre dès 1906 ; depuis, les adaptations cinématographiques et télévisuelles de cette œuvre immense se sont multipliées, avec plus d'une centaine de films et téléfilms produits à travers le monde."
"Hervé Bazin, de son nom de naissance Jean-Pierre Hervé-Bazin, né le 17 avril 1911 à Angers, commune où il est mort le 17 février 1996, est un écrivain et romancier français."
"Stieg Larsson, de son nom complet Karl Stig-Erland Larsson, né le 15 août 1954 à Skelleftehamn, dans la région de Västerbotten et mort le 9 novembre 2004 à Stockholm d'une crise cardiaque, est un journaliste et écrivain suédois connu pour son engagement contre l'extrémisme de droite et le racisme. Publiée à titre posthume entre 2005 et 2008, sa trilogie Millénium le rend mondialement célèbre."
"Charlotte Brontë [ˈʃɑːlət ˈbɹɒnteɪ], née le 21 avril 1816 à Thornton (comté d'Adams) et morte le 31 mars 1855 à Haworth (comté de Bergen), est une romancière anglaise.
Troisième fille du révérend Patrick Brontë, au sein d'une famille de condition modeste qui compte six enfants, elle bénéficie, comme ses quatre sœurs et son frère, de la présence d'un père qui a poussé ses études classiques jusqu'à l'université de Cambridge, et n'hésite pas à leur transmettre sa culture et sa vision du monde.
Elle connaît cependant très tôt, alors qu'elle est encore tout enfant, le deuil de sa mère, puis de ses deux sœurs aînées, frappées par la tuberculose.
Malgré sa condition de femme et son absence de moyens financiers, elle réussit à publier ses poèmes et ceux de ses sœurs (sous des noms masculins), en 1846, et surtout, à publier son œuvre principale Jane Eyre, devenu un grand classique de la littérature anglaise et mondiale, ayant également laissé une empreinte importante dans l'histoire culturelle en étant adapté au cinéma à plusieurs reprises."
