"Paolo Rumiz, né le 20 décembre 1947 à Trieste, est un journaliste et un écrivain voyageur italien."
Saverio Tomasella est un psychanalyste et écrivain français né à Saint-Cloud le 14 février 1966.
"Annelise Heurtier, née en 1979 à Villefranche-sur-Saône, est une écrivaine française, auteure d'ouvrages pour la jeunesse."
"Erik Orsenna, pseudonyme d’Éric Arnoult, est un écrivain né le 22 mars 1947 à Paris.
Il est membre de l'Académie française.

"
Christophe Tison est un journaliste et écrivain français né à Amiens en 1961.
"Sylvain Prudhomme, né en 1979 à La Seyne-sur-Mer, est un écrivain français.
Il est l'auteur de romans et de reportages, dont plusieurs ont pour cadre l'Afrique contemporaine, où il a vécu et travaillé."
Sally Nicholls (née le 22 juin 1983 à Stockton-on-Tees en Angleterre) est une auteure britannique de livres pour enfants.
"Maxime Drouot, connu sous les pseudonymes de Maxime Chattam et Maxime Williams, romancier français, né le 19 février 1976  à Herblay dans le Val-d'Oise, qui, à la suite d'études en criminologie, s'est spécialisé dans le roman policier."
"Ivan Jablonka, né le 23 octobre 1973 à Paris, est un historien et écrivain français, professeur d'histoire contemporaine à l'université Paris-XIII."
"Jean-Pierre Cabanes, né le 31 juillet 1949 à Montpellier, est un avocat et écrivain français."
Alain Ayroles est un scénariste de bande dessinée né le 26 janvier 1968 à Saint-Céré (Lot).
"Martha Wells, née le 1er septembre 1964 à Fort Worth au Texas, est une écrivaine américaine de science-fiction et de fantasy."
"Amélie Nothomb /ameli nɔtɔ̃b/, nom de plume de Fabienne Claire Nothomb, née le 9 juillet 1966 à Etterbeek (Région de Bruxelles-Capitale), est une romancière belge d'expression française.
Auteur prolifique, elle publie un ouvrage par an depuis son premier roman, Hygiène de l'assassin (1992). Ses romans font partie des meilleures ventes littéraires et certains sont traduits en plusieurs langues.
Ce succès lui vaut d'avoir été nommée commandeur de l'ordre de la Couronne et, sur la proposition du Vice-Premier Ministre et Ministre des Affaires étrangères, le Roi Philippe lui a accordé concession du titre personnel de baronne. Son roman Stupeur et Tremblements a remporté en 1999 le Grand prix du roman de l'Académie française.
En 2015, elle est élue membre de l'Académie royale de langue et de littérature françaises de Belgique."
Florence Hinckel est une autrice française  de romans pour enfants et adolescents.
"Karine Tuil, née le 3 mai 1972 à Paris, est une romancière française."
"Jérémie Kisling, né Jérémie Tschanz à Lausanne le 27 février 1976, est un auteur-compositeur-interprète suisse.
Jérémie Kisling explore divers moyens d’expression en français, poèmes, nouvelles, et arrive enfin, avec succès, à la chanson."
"Née le 3 janvier 1969 à Bayonne, au Pays basque, Marie Darrieussecq, est une écrivaine française. Elle est aussi traductrice et a exercé la profession de psychanalyste.
Ses livres explorent les non-dits et les territoires délaissés de la littérature. Son œuvre dense est marquée par un renouvellement constant des genres et des registres. Elle est publiée aux éditions P.O.L.
Son premier roman Truismes, publié à l’âge de 27 ans, qui relate la métamorphose d’une femme en truie, rencontre un succès mondial. Vendu à plus de 1 million d’exemplaires en France et à l’étranger, il est traduit dans une quarantaine de langues. 
En 2013, elle reçoit le prix Médicis et le Prix des Prix pour son roman Il faut beaucoup aimer les hommes."
"Léonora Miano, née le 12 mars 1973 à Douala (Cameroun), est une femme de lettres franco-camerounaise d'expression française."
"Ottessa Moshfegh, née en 20 mai 1981 à Boston dans le Massachusetts, est une écrivaine américaine."
"David Lagercrantz, né le 4 septembre 1962 à Solna, est un journaliste et auteur de best-sellers suédois, connu notamment pour avoir écrit une biographie de Zlatan Ibrahimović ainsi que les romans policiers Ce qui ne me tue pas, La Fille qui rendait coup pour coup et La Fille qui devait mourir, suites de la série littéraire Millénium de Stieg Larsson."
"Jonathan Coe, né le 19 août 1961 à Birmingham, est un écrivain britannique."
"Dominique Forma, né en 1962 à Puteaux, est un scénariste, réalisateur et écrivain franco-américain."
"Margaret Eleanor « Peggy » Atwood, née le 18 novembre 1939 à Ottawa, en Ontario, est une romancière, poétesse et critique littéraire canadienne. Elle est l'une des écrivaines canadiennes les plus connues, en particulier pour son roman La Servante écarlate (The Handmaid's Tale), publié en français en 1985, qui est adapté au cinéma sous le même titre par Volker Schlöndorff en 1990 et en série télévisée sous le titre The Handmaid's Tale : La Servante écarlate en 2017."
"Marion Brunet, née en 1976 dans le Vaucluse, est une femme de lettres française, auteure de roman policier et de littérature d'enfance et de jeunesse."
"Cécile Coulon, née le 13 juin 1990 à Clermont-Ferrand (Puy-de-Dôme), est une romancière, nouvelliste et poétesse française."
"Paolo Rumiz, né le 20 décembre 1947 à Trieste, est un journaliste et un écrivain voyageur italien."
"Éléonore Pourriat est une actrice, scénariste et réalisatrice française."
"Jean-Paul Dubois, né le 20 février 1950 à Toulouse, est un écrivain français."
"Jean-Baptiste Andrea, né le 4 avril 1971 à Saint-Germain-en-Laye, est un écrivain, scénariste et réalisateur français ."
Christophe Tison est un journaliste et écrivain français né à Amiens en 1961.
"Annelise Heurtier, née en 1979 à Villefranche-sur-Saône, est une écrivaine française, auteure d'ouvrages pour la jeunesse."
"Sylvain Prudhomme, né en 1979 à La Seyne-sur-Mer, est un écrivain français.
Il est l'auteur de romans et de reportages, dont plusieurs ont pour cadre l'Afrique contemporaine, où il a vécu et travaillé."
"Arno Strobel, né le 18 août 1962 à Sarrelouis en Allemagne, est un écrivain allemand, auteur de roman policier et littérature d'enfance et de jeunesse."
Jeanne Benameur est une écrivaine française née le 12 juillet 1952 à Ain M'lila en Algérie d'un père algérien et d'une mère italienne. Jeanne Benameur a trois sœurs et un frère.
Thierry Bizot est un producteur de télévision et écrivain français né le 12 mai 1962 à Milan.
"Monica Sabolo, née en 1971 à Milan en Italie, est une journaliste et écrivaine française."
Saverio Tomasella est un psychanalyste et écrivain français né à Saint-Cloud le 14 février 1966.
"Julien Dufresne-Lamy, né en 1987 à La Rochelle, est un écrivain français. Il vit à Paris."
"Erik Orsenna, pseudonyme d’Éric Arnoult, est un écrivain né le 22 mars 1947 à Paris.
Il est membre de l'Académie française.

"
"Antoine de Saint-Exupéry, né le 29 juin 1900 à Lyon et disparu en vol le 31 juillet 1944 au large de Marseille, mort pour la France, est un écrivain, poète, aviateur et reporter français.
Né dans une famille issue de la noblesse française, Antoine de Saint-Exupéry passe une enfance heureuse malgré les morts prématurées de son père et d'un frère. Élève rêveur, il obtient cependant son baccalauréat en 1917. Après son échec au concours de l'École navale, il s'oriente vers les beaux-arts et l'architecture. Devenu pilote durant son service militaire en 1922, il est engagé en 1926 par la compagnie Latécoère (future Aéropostale). Il transporte le courrier de Toulouse au Sénégal puis rejoint l'Amérique du Sud en 1929. Parallèlement, il devient écrivain. Il publie, en s'inspirant de ses expériences d'aviateur, ses premiers romans : Courrier sud en 1929 et surtout Vol de nuit en 1931, qui rencontre un grand succès.
À partir de 1932 Saint-Exupéry se consacre au journalisme et aux raids aériens. Il entreprend de grands reportages au Viêt Nam en 1934, à Moscou en 1935, en Espagne en 1936, qui nourriront sa réflexion sur les valeurs humanistes. Terre des hommes, publié en 1939, reçoit le grand prix du roman de l'Académie française.
En 1939, il sert dans l'armée de l'air, affecté à une escadrille de reconnaissance aérienne. À l'armistice de juin 1940, il quitte la France pour New York avec l'objectif de faire entrer les États-Unis dans la guerre et devient l'une des voix de la Résistance. Rêvant d'action, il rejoint enfin, au printemps 1944, en Sardaigne puis en Corse, une unité chargée de reconnaissances photographiques en vue du débarquement de Provence. Il disparaît en mer avec son avion, un Lockheed P-38 Lightning lors de sa mission du 31 juillet 1944. Son avion a été retrouvé et formellement identifié le 3 septembre 2003 au large de Marseille.
Le Petit Prince, écrit à New York pendant la guerre, et illustré avec ses propres aquarelles, est publié en 1943 à New York, puis en France chez Gallimard en 1946, à titre posthume. Ce conte philosophique empreint à la fois de légèreté et de pessimisme vis-à-vis de la nature humaine devient très vite un immense succès mondial."
"Joanne Rowling [ d͡ʒoʊˈæn ˈroʊlɪŋ], plus connue sous les noms de plume J. K. Rowling et Robert Galbraith, est une romancière et scénariste anglaise née le 31 juillet 1965 dans l’agglomération de Yate, dans le sud du Gloucestershire. Elle doit sa notoriété mondiale à la série Harry Potter, dont les romans traduits en près de quatre-vingts langues ont été vendus à plus de 500 millions d'exemplaires dans le monde.
Issue d’une famille modeste, elle a écrit sa première « histoire » à l'âge de six ans. Après des études à l'université d'Exeter ainsi qu'à la Sorbonne où elle a obtenu un diplôme en littérature française et en philologie, elle a travaillé un temps au sein d'Amnesty International, puis a enseigné l'anglais et le français. C'est à vingt-cinq ans qu'elle a bâti les premiers concepts et institutions de son univers sorcier, dans lequel un enfant orphelin découvrait à la fois son héritage tragique et ses talents de magicien. Elle a rédigé son premier roman, L'École des sorciers, dans un contexte de précarité et de dépression et a dû attendre plus d'un an avant sa publication en 1997 chez Bloomsbury.
Acclamée par ses lecteurs de tout âge et par la critique, J. K. Rowling a remporté de nombreux prix littéraires, notamment les prix Hugo, Locus et Bram Stoker, et a reçu la croix de chevalier de la Légion d'honneur en 2009. Mère de trois enfants, elle est réputée pour aborder des idées et des thèmes profonds avec accessibilité et humour, et s'attacher régulièrement à des personnages placés en marge de la société. Time Magazine l'a élue vice-championne du titre de la Personnalité de l'année en 2007, relevant l'inspiration sociale, morale et politique qu'elle aurait insufflée à ses fans. En octobre 2010, elle a également été nommée « Femme la plus influente de Grande-Bretagne » par les principaux éditeurs de magazines.
Le succès planétaire de son heptalogie romanesque, des films adaptés ainsi que des travaux dérivés de Harry Potter lui ont permis d'acquérir une fortune considérable, dont une partie est régulièrement reversée à de nombreuses associations caritatives luttant contre la maladie et les inégalités sociales. J. K. Rowling est devenue une philanthrope reconnue en cofondant notamment l'association Lumos qui œuvre pour la protection de l'enfance.
Elle se tourne vers un public adulte à partir de 2012 en publiant le roman social Une place à prendre, puis en entamant une série policière l'année suivante, sous un second nom de plume. Elle devient également scénariste pour le cinéma à partir de 2016 en étendant son univers sorcier à travers la série de films Les Animaux fantastiques, dont le premier volet a connu un succès international."
"Albert Camus, né le 7 novembre 1913 à Mondovi (aujourd’hui Dréan), près de Bône (aujourd’hui Annaba), en Algérie, et mort accidentellement le 4 janvier 1960 à Villeblevin, dans l'Yonne en France, est un écrivain, philosophe, romancier, dramaturge, journaliste, essayiste et nouvelliste français. Il est aussi journaliste militant engagé dans la Résistance française et, proche des courants libertaires,,, dans les combats moraux de l'après-guerre.
Son œuvre comprend des pièces de théâtre, des romans, des nouvelles, des films, des poèmes et des essais dans lesquels il développe un humanisme fondé sur la prise de conscience de l'absurde de la condition humaine mais aussi sur la révolte comme réponse à l'absurde, révolte qui conduit à l'action et donne un sens au monde et à l'existence, et « alors naît la joie étrange qui aide à vivre et mourir ». Il reçoit le prix Nobel de littérature en 1957.
Dans le journal Combat, ses prises de position sont audacieuses, aussi bien sur la question de l'indépendance de l'Algérie que sur ses rapports avec le Parti communiste français, qu'il quitte après un court passage de deux ans.
Il ne se dérobe devant aucun combat, protestant successivement contre les inégalités qui frappent les musulmans d'Afrique du Nord, puis contre la caricature du pied-noir exploiteur, ou prenant la défense des Espagnols exilés antifascistes, des victimes du stalinisme et des objecteurs de conscience.
En marge des courants philosophiques, Camus est d'abord témoin de son temps, refusant toute compromission. Il n'a cessé de lutter contre toutes les idéologies et les abstractions qui détournent de l'humain. Il est ainsi amené à s'opposer à l'existentialisme et au marxisme, sa critique du totalitarisme soviétique lui vaut les anathèmes de communistes et sa rupture avec Jean-Paul Sartre."
"Patrick Süskind est un écrivain et scénariste allemand. Il est né le 26 mars 1949 à Ambach à côté du lac de Starnberg (am Starnberger See), en Bavière près de Munich. Il a grandi dans le village bavarois de Holzhausen.
Il étudie l’histoire (histoire médiévale et contemporaine) et la littérature à Munich et à Aix-en-Provence. Il travaille ensuite comme scénariste pour la télévision. 
Il écrit une pièce de théâtre à un personnage  : La Contrebasse, qui sera jouée pour la première fois à Munich en 1981. Elle sera publiée en 1984. Depuis sa création, cette pièce est régulièrement jouée en Allemagne et a également été interprétée à Paris par Jacques Villeret dans le rôle-titre.
Le Parfum est son premier roman édité en 1985 à Zurich, sous le titre Das Parfum, Die Geschichte eines Mörders, puis publié en France en 1986 aux éditions Fayard dans une traduction de Bernard Lortholary. Il vaut à son auteur un succès mondial. Il a d'ailleurs fait l'objet d'une adaptation au cinéma en 2006  : Le Parfum, Histoire d'un meurtrier."
"Daniel Gerhard Brown, dit Dan Brown, né le 22 juin 1964 à Exeter dans le New Hampshire, est un romancier américain, auteur de plusieurs best-sellers appartenant au genre du roman policier mâtiné d'ésotérisme, qui a vendu près de deux cents millions d'exemplaires.
Il a suscité une grande polémique avec la publication de ses romans ayant pour héros Robert Langdon : Anges et Démons, Da Vinci Code, Le Symbole perdu , Inferno et Origine."
"George Orwell [dʒɔː(ɹ)dʒ ˈɔːwel], nom de plume d’Eric Arthur Blair, né le 25 juin 1903 à Motihari (Inde) pendant la période du Raj britannique et mort le 21 janvier 1950 à Londres, est un écrivain, essayiste et journaliste britannique.
Son œuvre porte la marque de ses engagements, qui trouvent eux-mêmes pour une large part leur source dans l'expérience personnelle de l'auteur : contre l'impérialisme britannique, après son engagement de jeunesse comme représentant des forces de l'ordre colonial en Birmanie ; pour la justice sociale et le socialisme libertaire,, après avoir observé et partagé les conditions d'existence des classes laborieuses à Londres et à Paris ; contre les totalitarismes nazi et soviétique, après sa participation à la guerre d'Espagne. Politiquement, il s'est parfois qualifié d'« anarchiste conservateur » (tory anarchist en anglais), et il est souvent comparé à la philosophe Simone Weil en raison de ses prises de positions originales pour un socialiste,.
Témoin de son époque, Orwell est dans les années 1930 et 1940 chroniqueur, critique littéraire et romancier. De cette production variée, les deux œuvres au succès le plus durable sont deux textes publiés après la Seconde Guerre mondiale : La Ferme des animaux et surtout 1984, roman dans lequel il crée le concept de Big Brother, depuis passé dans le langage courant de la critique des techniques modernes de surveillance et de contrôle des individus. L'adjectif « orwellien » est également fréquemment utilisé en référence à l'univers totalitaire imaginé par cet écrivain anglais."
"Paulo Coelho [ˈpawlu kuˈeʎu], né le 24 août 1947 à Rio de Janeiro, est un romancier et un interprète brésilien. Il a acquis une renommée internationale avec la publication de L'Alchimiste, vendu à 85 millions d'exemplaires. En ajoutant ses autres ouvrages, ce sont 225 millions d'exemplaires vendus à travers le monde. Ses romans ont été traduits dans 81 langues du monde entier."
"Gustave Flaubert est un écrivain français né à Rouen le 12 décembre 1821 et mort à Croisset, lieu-dit de la commune de Canteleu, le 8 mai 1880.
Prosateur de premier plan de la seconde moitié du XIXe siècle, Gustave Flaubert a marqué la littérature universelle par la profondeur de ses analyses psychologiques, son souci de réalisme, son regard lucide sur les comportements des individus et de la société, et par la force de son style dans de grands romans comme Madame Bovary (1857), Salammbô (1862), L'Éducation sentimentale (1869), ou le recueil de nouvelles Trois contes (1877)."
"Joanne Rowling [ d͡ʒoʊˈæn ˈroʊlɪŋ], plus connue sous les noms de plume J. K. Rowling et Robert Galbraith, est une romancière et scénariste anglaise née le 31 juillet 1965 dans l’agglomération de Yate, dans le sud du Gloucestershire. Elle doit sa notoriété mondiale à la série Harry Potter, dont les romans traduits en près de quatre-vingts langues ont été vendus à plus de 500 millions d'exemplaires dans le monde.
Issue d’une famille modeste, elle a écrit sa première « histoire » à l'âge de six ans. Après des études à l'université d'Exeter ainsi qu'à la Sorbonne où elle a obtenu un diplôme en littérature française et en philologie, elle a travaillé un temps au sein d'Amnesty International, puis a enseigné l'anglais et le français. C'est à vingt-cinq ans qu'elle a bâti les premiers concepts et institutions de son univers sorcier, dans lequel un enfant orphelin découvrait à la fois son héritage tragique et ses talents de magicien. Elle a rédigé son premier roman, L'École des sorciers, dans un contexte de précarité et de dépression et a dû attendre plus d'un an avant sa publication en 1997 chez Bloomsbury.
Acclamée par ses lecteurs de tout âge et par la critique, J. K. Rowling a remporté de nombreux prix littéraires, notamment les prix Hugo, Locus et Bram Stoker, et a reçu la croix de chevalier de la Légion d'honneur en 2009. Mère de trois enfants, elle est réputée pour aborder des idées et des thèmes profonds avec accessibilité et humour, et s'attacher régulièrement à des personnages placés en marge de la société. Time Magazine l'a élue vice-championne du titre de la Personnalité de l'année en 2007, relevant l'inspiration sociale, morale et politique qu'elle aurait insufflée à ses fans. En octobre 2010, elle a également été nommée « Femme la plus influente de Grande-Bretagne » par les principaux éditeurs de magazines.
Le succès planétaire de son heptalogie romanesque, des films adaptés ainsi que des travaux dérivés de Harry Potter lui ont permis d'acquérir une fortune considérable, dont une partie est régulièrement reversée à de nombreuses associations caritatives luttant contre la maladie et les inégalités sociales. J. K. Rowling est devenue une philanthrope reconnue en cofondant notamment l'association Lumos qui œuvre pour la protection de l'enfance.
Elle se tourne vers un public adulte à partir de 2012 en publiant le roman social Une place à prendre, puis en entamant une série policière l'année suivante, sous un second nom de plume. Elle devient également scénariste pour le cinéma à partir de 2016 en étendant son univers sorcier à travers la série de films Les Animaux fantastiques, dont le premier volet a connu un succès international."
"Agatha Christie, née Agatha Mary Clarissa Miller le 15 septembre 1890 à Torquay et morte le 12 janvier 1976 à Wallingford (Oxfordshire), est une femme de lettres britannique, auteure de nombreux romans policiers. Son nom est associé à celui de ses deux héros : Hercule Poirot, détective professionnel belge, et Miss Marple, détective amateur. On la surnomme la « Reine du crime ». En effet, Agatha Christie est l'une des écrivaines les plus importantes et novatrices du genre policier. Elle a aussi écrit plusieurs romans, dont quelques histoires sentimentales, sous le pseudonyme de Mary Westmacott.
Agatha Christie fait partie des écrivains les plus connus au monde et elle est considérée comme l'auteure la plus lue de l'histoire chez les Anglo-Saxons, après William Shakespeare ; c'est aussi de très loin l'auteure la plus traduite dans le monde. Elle a publié 66 romans, 154 nouvelles et 20 pièces de théâtre, ces œuvres ayant été traduites dans le monde entier. La plupart des intrigues se déroulent à huis clos, ce qui permet au lecteur d'essayer de deviner l'identité du coupable avant la fin du récit. Mais toute la saveur de ses histoires réside justement dans la résolution de l'enquête, souvent improbable, prenant le lecteur par surprise.
Ses romans et nouvelles ont été adaptés au cinéma, dans des jeux vidéos ou à la télévision, en particulier Le Crime de l'Orient-Express, Dix petits nègres, Mort sur le Nil, Le Train de 16 h 50 et Témoin à charge."
"Joanne Rowling [ d͡ʒoʊˈæn ˈroʊlɪŋ], plus connue sous les noms de plume J. K. Rowling et Robert Galbraith, est une romancière et scénariste anglaise née le 31 juillet 1965 dans l’agglomération de Yate, dans le sud du Gloucestershire. Elle doit sa notoriété mondiale à la série Harry Potter, dont les romans traduits en près de quatre-vingts langues ont été vendus à plus de 500 millions d'exemplaires dans le monde.
Issue d’une famille modeste, elle a écrit sa première « histoire » à l'âge de six ans. Après des études à l'université d'Exeter ainsi qu'à la Sorbonne où elle a obtenu un diplôme en littérature française et en philologie, elle a travaillé un temps au sein d'Amnesty International, puis a enseigné l'anglais et le français. C'est à vingt-cinq ans qu'elle a bâti les premiers concepts et institutions de son univers sorcier, dans lequel un enfant orphelin découvrait à la fois son héritage tragique et ses talents de magicien. Elle a rédigé son premier roman, L'École des sorciers, dans un contexte de précarité et de dépression et a dû attendre plus d'un an avant sa publication en 1997 chez Bloomsbury.
Acclamée par ses lecteurs de tout âge et par la critique, J. K. Rowling a remporté de nombreux prix littéraires, notamment les prix Hugo, Locus et Bram Stoker, et a reçu la croix de chevalier de la Légion d'honneur en 2009. Mère de trois enfants, elle est réputée pour aborder des idées et des thèmes profonds avec accessibilité et humour, et s'attacher régulièrement à des personnages placés en marge de la société. Time Magazine l'a élue vice-championne du titre de la Personnalité de l'année en 2007, relevant l'inspiration sociale, morale et politique qu'elle aurait insufflée à ses fans. En octobre 2010, elle a également été nommée « Femme la plus influente de Grande-Bretagne » par les principaux éditeurs de magazines.
Le succès planétaire de son heptalogie romanesque, des films adaptés ainsi que des travaux dérivés de Harry Potter lui ont permis d'acquérir une fortune considérable, dont une partie est régulièrement reversée à de nombreuses associations caritatives luttant contre la maladie et les inégalités sociales. J. K. Rowling est devenue une philanthrope reconnue en cofondant notamment l'association Lumos qui œuvre pour la protection de l'enfance.
Elle se tourne vers un public adulte à partir de 2012 en publiant le roman social Une place à prendre, puis en entamant une série policière l'année suivante, sous un second nom de plume. Elle devient également scénariste pour le cinéma à partir de 2016 en étendant son univers sorcier à travers la série de films Les Animaux fantastiques, dont le premier volet a connu un succès international."
