"Émile Zola est un écrivain et journaliste français, né le 2 avril 1840 à Paris, où il est mort le 29 septembre 1902. Considéré comme le chef de file du naturalisme, c'est l'un des romanciers français les plus populaires, les plus publiés, traduits et commentés au monde. Ses romans ont connu de très nombreuses adaptations au cinéma et à la télévision.
Sa vie et son œuvre ont fait l'objet de nombreuses études historiques. Sur le plan littéraire, il est principalement connu pour Les Rougon-Macquart, fresque romanesque en vingt volumes dépeignant la société française sous le Second Empire et qui met en scène la trajectoire de la famille des Rougon-Macquart, à travers ses différentes générations et dont chacun des représentants d'une époque et d'une génération particulière fait l'objet d'un roman.
Les dernières années de sa vie sont marquées par son engagement dans l'affaire Dreyfus avec la publication en janvier 1898, dans le quotidien L'Aurore, de l'article intitulé « J'accuse… ! » qui lui a valu un procès pour diffamation et un exil à Londres la même année."
"Jean-Baptiste Poquelin, dit Molière, est un comédien et dramaturge français, baptisé le 15 janvier 1622 à Paris, où il est mort le 17 février 1673.
Issu d'une famille de marchands parisiens, il s'associe à 21 ans avec une dizaine de camarades, dont la comédienne Madeleine Béjart, pour former la troupe de l’Illustre Théâtre qui, malgré la collaboration de dramaturges de renom, ne parvient pas à s'imposer à Paris. Pendant treize ans, Molière et ses amis Béjart parcourent les provinces méridionales du royaume au sein d'une troupe itinérante entretenue par plusieurs protecteurs successifs. Au cours de cette période, Molière compose quelques farces ou petites comédies et ses deux premières grandes comédies. De retour à Paris en 1658, il devient vite, à la tête de sa troupe, le comédien et auteur favori du jeune Louis XIV et de sa cour, pour lesquels il conçoit de nombreux spectacles, en collaboration avec les meilleurs architectes scéniques, chorégraphes et musiciens du temps. Il meurt à l’âge de 51 ans, quelques heures après avoir tenu pour la quatrième fois le rôle-titre du Malade imaginaire.
Grand créateur de formes dramatiques, interprète du rôle principal de la plupart de ses pièces, Molière a exploité les diverses ressources du comique — verbal, gestuel et visuel, de situation — et pratiqué tous les genres de comédie, de la farce à la comédie de caractère. Il a créé des personnages individualisés, à la psychologie complexe, qui sont rapidement devenus des archétypes. Observateur lucide et pénétrant, il peint les mœurs et les comportements de ses contemporains, n'épargnant guère que les ecclésiastiques et les hauts dignitaires de la monarchie, pour le plus grand plaisir de son public, tant à la cour qu'à la ville. Loin de se limiter à des divertissements anodins, ses grandes comédies remettent en cause des principes d'organisation sociale bien établis, suscitant de retentissantes polémiques et l'hostilité durable des milieux dévots.
L'œuvre de Molière, une trentaine de comédies en vers ou en prose, accompagnées ou non d'entrées de ballet et de musique, constitue un des piliers de l'enseignement littéraire en France. Elle continue de remporter un vif succès en France et dans le monde entier, et reste l'une des références de la littérature universelle,. 
Sa vie mouvementée et sa forte personnalité ont inspiré dramaturges et cinéastes. Signe de la place emblématique qu’il occupe dans la culture française et francophone, le français est couramment désigné par la périphrase « langue de Molière », au même titre que, par exemple, l’allemand est « langue de Goethe », l’anglais « langue de Shakespeare », l’espagnol « langue de Cervantès » et l’italien « langue de Dante »."
"Alexandre Dumas (dit aussi Alexandre Dumas père) est un écrivain français né le 24 juillet 1802 à Villers-Cotterêts (Aisne) et mort le 5 décembre 1870 au hameau de Puys, ancienne commune de Neuville-lès-Dieppe, aujourd'hui intégrée à Dieppe (Seine-Maritime).
Il est le fils de Marie-Louise Labouret (1769-1838) et Thomas Alexandre Davy de La Pailleterie (1762-1806) (né à Saint-Domingue, actuelle Haïti) dit le général Dumas, et le père des écrivains Henry Bauër et Alexandre Dumas (1824-1895) dit « Dumas fils », auteur de La Dame aux camélias.
Proche des romantiques et tourné vers le théâtre, Alexandre Dumas écrit d'abord un vaudeville à succès et des drames historiques comme Henri III et sa cour (1829), La Tour de Nesle (1832), Kean (1836). Auteur prolifique, il s'oriente ensuite vers le roman historique telles que la trilogie Les Trois Mousquetaires (1844), Vingt ans après (1845) et Le Vicomte de Bragelonne (1847), ou encore Le Comte de Monte-Cristo (1844-1846), La Dame de Monsoreau (1846) et La Reine Margot (1845).
La paternité de certaines de ses œuvres lui est contestée. Dumas fut ainsi soupçonné par plusieurs critiques de son époque d'avoir eu recours à des nègres littéraires, notamment Auguste Maquet. Toutefois les recherches contemporaines ont montré que Dumas avait mis en place une coopération avec ce dernier : Dumas s'occupait de choisir le thème général et modifiait les ébauches de Maquet pour les rendre plus dynamiques. On ne peut donc lui nier la paternité de son œuvre, même s'il n'aurait peut-être pas pu réaliser tous ses chefs-d'œuvre des années 1844-1850 sans la présence à ses côtés d'un collaborateur à tout faire efficace et discret."
Gilles Legardinier est un écrivain et scénariste français né le 27 octobre 1965  à Paris. Son roman Demain j'arrête ! obtient un grand succès.
"Edmond Rostand, né le 1er avril 1868 à Marseille et mort le 2 décembre 1918 à Paris, est un écrivain, dramaturge, poète et essayiste français.
Il est l'auteur de l'une des pièces les plus connues du théâtre français, Cyrano de Bergerac. Il est, par ailleurs, l'époux de la poétesse Rosemonde Gérard et le père de l'écrivain, biologiste et académicien français Jean Rostand."
"Ernest Miller Hemingway [ˈɝnɪst ˈmɪlɚ ˈhɛmɪŋˌweɪ], né le 21 juillet 1899 à Oak Park dans l'Illinois aux États-Unis et mort le 2 juillet 1961 à Ketchum (Idaho), est un écrivain, journaliste et correspondant de guerre américain.
Son style d'écriture, caractérisé par l'économie et la litote, a influencé le roman du XXe siècle, comme l'ont fait sa vie d'aventurier et l'image publique qu'il entretenait. Il a écrit la plupart de ses œuvres entre le milieu des années 1920 et le milieu des années 1950, et sa carrière a culminé en 1954 lorsqu'il a remporté le prix Nobel de littérature. Ses romans ont rencontré un grand succès auprès du public du fait de la véracité avec laquelle il dépeignait ses personnages. Plusieurs de ses œuvres furent élevées au rang de classiques de la littérature américaine. Il a publié sept romans, six recueils de nouvelles et deux œuvres non romanesques de son vivant. Trois romans, quatre recueils de nouvelles et trois œuvres non romanesques ont été publiés à titre posthume.
Hemingway est né et a grandi à Oak Park, une ville située en banlieue ouest de Chicago dans l'Illinois. Après avoir quitté le lycée, il a travaillé pendant quelques mois en tant que journaliste, avant de partir pour le front italien et devenir ambulancier pendant la Première Guerre mondiale, ce qui a servi de fondement à son roman L'Adieu aux armes. Il fut grièvement blessé et passa alors plus de trois mois à l'hôpital. À sa sortie, il s'engagea dans l'armée italienne. En 1922, Hemingway épousa Hadley Richardson, la première de ses quatre épouses, et le couple s'installa à Paris où il travailla comme correspondant étranger. Au cours de cette période, il rencontra et fut influencé par des écrivains et des artistes modernistes des années 1920 de la communauté expatriée connus sous le nom de Génération perdue. Son premier roman, Le Soleil se lève aussi, a été écrit en 1926.
Après avoir divorcé d'Hadley Richardson en 1927, Hemingway épousa Pauline Pfeiffer mais ils divorcèrent après le retour d'Hemingway d'Espagne où il avait couvert la guerre civile espagnole, qui lui permit d'écrire Pour qui sonne le glas. Martha Gellhorn devint sa troisième épouse en 1940, mais il la quitta pour Mary Welsh après la Seconde Guerre mondiale, période pendant laquelle il fut présent le jour du débarquement en Normandie et celui de la libération de Paris.
Peu de temps après la publication du Vieil homme et la mer, en 1952, qui lui valut le prix Pulitzer en 1953, Hemingway participa à un safari en Afrique, où il faillit être tué dans un accident d'avion qui le laissa perclus de douleurs et en mauvaise santé pendant le reste de sa vie.
Hemingway avait habité à Key West, en Floride et à La Havane pendant les années 1930 et 1940, mais, en 1959, il quitta Cuba pour Ketchum, dans l'Idaho, où il se suicide au cours de l'été 1961."
"Guillaume Musso, né le 6 juin 1974 à Antibes, est un romancier français."
"Edgar Allan Poe [ˈɛdɡɚ ˈælən poʊ], né le 19 janvier 1809 à Boston et mort à Baltimore le 7 octobre 1849, est un poète, romancier, nouvelliste, critique littéraire, dramaturge et éditeur américain, ainsi que l'une des principales figures du romantisme américain. Connu surtout pour ses contes — genre dont la brièveté lui permet de mettre en valeur sa théorie de l'effet, suivant laquelle tous les éléments du texte doivent concourir à la réalisation d'un effet unique — il a donné à la nouvelle ses lettres de noblesse et est considéré comme l’inventeur du roman policier. Nombre de ses récits préfigurent les genres de la science-fiction et du fantastique.
Né à Boston, Edgar Allan Poe perd ses parents, David Poe Jr. et Elizabeth Arnold, dans sa petite enfance ; il est recueilli par John et Frances Allan de Richmond, en Virginie, où il passe l’essentiel de ses jeunes années, si l’on excepte un séjour en Angleterre et en Écosse, dans une aisance relative. Après un bref passage à l’Université de Virginie et des tentatives de carrière militaire, Poe quitte les Allan. Sa carrière littéraire débute humblement par la publication anonyme, en 1827, de Tamerlan et autres poèmes, un recueil de poèmes signés seulement « par un Bostonien ». Poe s’installe à Baltimore, où il vit auprès de sa famille paternelle et abandonne quelque peu la poésie pour la prose. En juillet 1835, il devient rédacteur-assistant au Southern Literary Messenger de Richmond, où il contribue à augmenter les abonnements et commence à développer son propre style de critique littéraire. La même année, à vingt-six ans, il épouse sa cousine germaine Virginia Clemm, alors âgée de 13 ans.
Après l’échec de son roman Les Aventures d'Arthur Gordon Pym, Poe réalise son premier recueil d’histoires, les Contes du Grotesque et de l’Arabesque, en 1839. La même année, il devient rédacteur au Burton's Gentleman's Magazine, puis au Graham's Magazine à Philadelphie. C'est à Philadelphie que nombre de ses œuvres parmi les plus connues ont été publiées. Dans cette ville, Poe a également projeté la création de son propre journal, The Penn (plus tard rebaptisé The Stylus), qui ne verra jamais le jour. En février 1844, il déménage à New York, où il travaille au Broadway Journal, un magazine dont il devient finalement l’unique propriétaire.
En janvier 1845, Poe publie Le Corbeau, qui connaît un succès immédiat. Mais, deux ans plus tard, son épouse Virginia meurt de tuberculose, le 30 janvier 1847. Poe envisage de se remarier, mais aucun projet ne se réalisera. Le 7 octobre 1849, Poe meurt à l’âge de 40 ans à Baltimore. Les causes de sa mort n’ont pas pu être déterminées et ont été attribuées diversement à l’alcool, à une drogue, au choléra, à la rage, à une maladie du cœur, à une congestion cérébrale, etc.
L'influence de Poe a été et demeure importante, aux États-Unis comme dans l'ensemble du monde, non seulement sur la littérature, mais également sur d'autres domaines artistiques tels le cinéma et la musique, ou encore dans des domaines scientifiques. Bien qu'auteur américain, il a d’abord été reconnu et défendu par des auteurs français, Baudelaire et Mallarmé en tête. La critique contemporaine le situe parmi les plus remarquables écrivains de la littérature américaine du XIXe siècle."
"Jonas Jonasson, né le 6 juillet 1961 à Växjö, est un écrivain et journaliste suédois.
Son premier roman Le Vieux qui ne voulait pas fêter son anniversaire a été vendu à plus de sept cent mille exemplaires en Suède."
"Guillaume Musso, né le 6 juin 1974 à Antibes, est un romancier français."
"Jean Edith Camilla Läckberg Eriksson, née le 30 août 1974 à Fjällbacka, est une écrivaine suédoise, auteure de romans policiers. Elle est une des plus jeunes auteures à succès dans son genre : en janvier 2010, le classement de plusieurs magazines dédiés à l'édition, dont Livres-Hebdo en France et The Bookseller (en) en Grande-Bretagne, la place sixième au rang des écrivains de fiction les plus vendus en Europe en 2009. Les romans de Camilla Läckberg se situent tous près de son lieu de naissance, la petite ville côtière de Fjällbacka, en Suède,."
"Arthur Conan Doyle (né Arthur Ignatius Conan Doyle le 22 mai 1859 à Édimbourg, en Écosse, et mort le 7 juillet 1930 à Crowborough dans le Sussex de l'Est, en Angleterre) est un écrivain et médecin britannique. Conan est l'un de ses prénoms et Doyle son nom de famille. Il doit sa célébrité à ses romans et nouvelles mettant en scène le détective Sherlock Holmes — considérés comme une innovation majeure du roman policier — et le professeur Challenger. Cet écrivain prolifique a également été l'auteur de livres de science-fiction, de romans historiques, de pièces de théâtre, de poésies et d'œuvres historiques.
Il a été élevé au rang de Chevalier de l'ordre du Très vénérable ordre de Saint-Jean par le roi Édouard VII le 24 octobre 1902."
"William Shakespeare, baptisé le 26 avril 1564 à Stratford-upon-Avon et mort le 23 avril 1616 (3 mai 1616 dans le calendrier grégorien) dans la même ville, est considéré comme l'un des plus grands poètes, dramaturges et écrivains de la culture anglaise. Il est réputé pour sa maîtrise des formes poétiques et littéraires, ainsi que sa capacité à représenter les aspects de la nature humaine.
Figure éminente de la culture occidentale, Shakespeare continue d’influencer les artistes d’aujourd’hui. Il est traduit dans un grand nombre de langues et, selon l'Index Translationum, avec un total de 4 281 traductions, il vient au troisième rang des auteurs les plus traduits après Agatha Christie et Jules Verne. Ses pièces sont régulièrement jouées partout dans le monde. Shakespeare est l’un des rares dramaturges à avoir pratiqué aussi bien la comédie que la tragédie.
Shakespeare écrivit trente-sept œuvres dramatiques, entre les années 1580 et 1613. Mais la chronologie exacte de ses pièces est encore discutée. Cependant, le volume de ses créations n'apparaît pas comme exceptionnel en regard de critères de l’époque.
On mesure l’influence de Shakespeare sur la culture anglo-saxonne en observant les nombreuses références qui lui sont faites, que ce soit à travers des citations, des titres d’œuvres ou les innombrables adaptations de ses œuvres. L'anglais est d'ailleurs couramment désigné par la périphrase la langue de Shakespeare, tant cet auteur a marqué la langue de son pays en inventant de nombreux termes et expressions. Certaines citations d'ailleurs sont passées telles quelles dans le langage courant,."
"Jean-Baptiste Poquelin, dit Molière, est un comédien et dramaturge français, baptisé le 15 janvier 1622 à Paris, où il est mort le 17 février 1673.
Issu d'une famille de marchands parisiens, il s'associe à 21 ans avec une dizaine de camarades, dont la comédienne Madeleine Béjart, pour former la troupe de l’Illustre Théâtre qui, malgré la collaboration de dramaturges de renom, ne parvient pas à s'imposer à Paris. Pendant treize ans, Molière et ses amis Béjart parcourent les provinces méridionales du royaume au sein d'une troupe itinérante entretenue par plusieurs protecteurs successifs. Au cours de cette période, Molière compose quelques farces ou petites comédies et ses deux premières grandes comédies. De retour à Paris en 1658, il devient vite, à la tête de sa troupe, le comédien et auteur favori du jeune Louis XIV et de sa cour, pour lesquels il conçoit de nombreux spectacles, en collaboration avec les meilleurs architectes scéniques, chorégraphes et musiciens du temps. Il meurt à l’âge de 51 ans, quelques heures après avoir tenu pour la quatrième fois le rôle-titre du Malade imaginaire.
Grand créateur de formes dramatiques, interprète du rôle principal de la plupart de ses pièces, Molière a exploité les diverses ressources du comique — verbal, gestuel et visuel, de situation — et pratiqué tous les genres de comédie, de la farce à la comédie de caractère. Il a créé des personnages individualisés, à la psychologie complexe, qui sont rapidement devenus des archétypes. Observateur lucide et pénétrant, il peint les mœurs et les comportements de ses contemporains, n'épargnant guère que les ecclésiastiques et les hauts dignitaires de la monarchie, pour le plus grand plaisir de son public, tant à la cour qu'à la ville. Loin de se limiter à des divertissements anodins, ses grandes comédies remettent en cause des principes d'organisation sociale bien établis, suscitant de retentissantes polémiques et l'hostilité durable des milieux dévots.
L'œuvre de Molière, une trentaine de comédies en vers ou en prose, accompagnées ou non d'entrées de ballet et de musique, constitue un des piliers de l'enseignement littéraire en France. Elle continue de remporter un vif succès en France et dans le monde entier, et reste l'une des références de la littérature universelle,. 
Sa vie mouvementée et sa forte personnalité ont inspiré dramaturges et cinéastes. Signe de la place emblématique qu’il occupe dans la culture française et francophone, le français est couramment désigné par la périphrase « langue de Molière », au même titre que, par exemple, l’allemand est « langue de Goethe », l’anglais « langue de Shakespeare », l’espagnol « langue de Cervantès » et l’italien « langue de Dante »."
"Pierre Corneille, aussi appelé « le Grand Corneille » ou « Corneille l'aîné », né le 6 juin 1606 à Rouen et mort le 1er octobre 1684 à Paris (paroisse Saint-Roch), est un dramaturge et poète français du XVIIe siècle.
Issu d'une famille de la bourgeoisie de robe, Pierre Corneille, après des études de droit, occupa des offices d'avocat à Rouen tout en se tournant vers la littérature, comme bon nombre de diplômés en droit de son temps. Il écrivit d'abord des comédies comme Mélite, La Place royale, L'Illusion comique, et des tragi-comédies Clitandre (vers 1630) et en 1637, Le Cid, qui fut un triomphe, malgré les critiques de ses rivaux et des théoriciens. Il avait aussi donné dès 1634-35 une tragédie mythologique (Médée), mais ce n'est qu'en 1640 qu'il se lança dans la voie de la tragédie historique — il fut le dernier des poètes dramatiques de sa génération à le faire —, donnant ainsi ce que la postérité considéra comme ses chefs-d’œuvre : Horace, Cinna, Polyeucte, Rodogune, Héraclius et Nicomède.
Déçu par l'accueil rencontré par Pertharite (1652, pendant les troubles de la Fronde), au moment où le début de sa traduction de L'Imitation de Jésus-Christ connaissait un extraordinaire succès de librairie, il décida de renoncer à l'écriture théâtrale et acheva progressivement la traduction de L'Imitation. Plusieurs de ses confrères, constatant à leur tour que la Fronde avait occasionné un rejet de la tragédie historique et politique, renoncèrent de même à écrire des tragédies ou se concentrèrent sur le genre de la comédie. Tenté dès 1656 de revenir au théâtre par le biais d'une tragédie à grand spectacle que lui avait commandée un noble normand (La Conquête de la Toison d'or, créée à Paris six ans plus tard fut l'un des plus grands succès du siècle), occupé les années suivantes à corriger tout son théâtre pour en publier une nouvelle édition accompagnée de discours critiques et théoriques, il céda facilement en 1658 à l'invitation du surintendant Nicolas Fouquet et revint au théâtre au début de 1659 en proposant une réécriture du sujet-phare de la tragédie, Œdipe. Cette pièce fut très bien accueillie et Corneille enchaîna ensuite les succès durant quelques années, mais la faveur grandissante des tragédies où dominait l'expression du sentiment amoureux (de Quinault, de son propre frère Thomas, et enfin de Jean Racine) relégua ses créations au second plan. Il cessa d'écrire après le succès mitigé de Suréna en 1674. La tradition biographique des XVIIIe et XIXe siècles a imaginé un Corneille confronté à des difficultés matérielles durant ses dernières années, mais tous les travaux de la deuxième moitié du XXe siècle révèlent qu'il n'en a rien été et que Corneille a achevé sa vie dans une confortable aisance.
Son œuvre, 32 pièces au total, est variée : à côté de comédies proches de l'esthétique baroque, pleines d'invention théâtrale comme L'Illusion comique, Pierre Corneille a su donner une puissance émotionnelle et réflexive toute nouvelle à la tragédie moderne, apparue en France au milieu du XVIIe siècle. Aux prises avec la mise en place des règles classiques, il a marqué de son empreinte le genre par les hautes figures qu'il a créées : des âmes fortes confrontées à des choix moraux fondamentaux (le fameux « dilemme cornélien ») comme Rodrigue qui doit choisir entre amour et honneur familial, Auguste qui préfère la clémence à la vengeance ou Polyeucte placé entre l'amour humain et l'amour de Dieu. Si les figures des jeunes hommes pleins de fougue (Rodrigue, le jeune Horace) s'associent à des figures de pères nobles (Don Diègue ou le vieil Horace), les figures masculines ne doivent pas faire oublier les personnages féminins vibrant de sentiments comme Chimène dans Le Cid, Camille dans Horace ou Cléopâtre, reine de Syrie, dans Rodogune. Aussi marquée par la puissance d'un alexandrin rythmé qui donne de célèbres morceaux de bravoure (monologue de Don Diègue dans Le Cid, imprécations de Camille dans Horace) et la force de maximes à certaines paroles (« À vaincre sans péril, on triomphe sans gloire », Le Cid, II, 2 - « Laisse faire le temps, ta vaillance et ton roi », dernier vers du Cid - « Je suis maître de moi comme de l'univers », Cinna, V, 3 - « Dieu ne veut point d'un cœur où le monde domine » Polyeucte, I, 1).
Le théâtre de Pierre Corneille fait ainsi écho aux tournures du Grand Siècle dont il reflète aussi les valeurs comme l'honneur et les grandes interrogations, sur le pouvoir par exemple (contexte de la mort de Richelieu et de Louis XIII), la question de la guerre civile dans La Mort de Pompée (1643), ou la lutte pour le trône dans Nicomède (1651, dans le contexte de la Fronde). Aujourd'hui, il compte parmi l'un des auteurs les plus joués et par ailleurs, l'un des références de la littérature universelle,."
"Veronica Anne Roth, née le 19 août 1988 à New York. Ses parents se sont séparés quand elle avais cinq ans. C'est une écrivaine américaine diplômée de l'Université Northwestern, en écriture créative. Elle est principalement connue pour sa trilogie Divergente (Divergence au Québec). Son premier livre, Divergent, tout comme son deuxième, Divergente 2 (Insurgent en anglais) ont été sélectionnés par le New York Times dans sa liste des best-sellers. Elle est également récipiendaire des Goodreads 2011 Choice Awards. Les droits filmiques de Divergent ont été vendus en avril 2012 et le film est sorti le 21 mars 2014 en Amérique du Nord."
"Anna Gavalda est une femme de lettres française, née le 9 décembre 1970 à Boulogne-Billancourt."
