"Boris Vian, né le 10 mars 1920 à Ville-d'Avray (Seine-et-Oise, aujourd'hui Hauts-de-Seine) et mort le 23 juin 1959 à Paris (7e arrondissement), est un écrivain, poète, parolier, chanteur, critique musical, musicien de jazz (trompettiste) et directeur artistique français. Ingénieur formé à l'École centrale, il s'est aussi adonné aux activités de scénariste, de traducteur (anglais américain), de conférencier, d'acteur et de peintre.
Sous le pseudonyme de Vernon Sullivan, il a publié plusieurs romans dans le style américain, parmi lesquels J'irai cracher sur vos tombes qui a fait scandale et lui valut un procès retentissant. Si les écrits de Vernon Sullivan ont attiré à Boris Vian beaucoup d'ennuis avec la justice et le fisc, ils l'ont momentanément enrichi à tel point qu'il pouvait dire que Vernon Sullivan faisait vivre Boris Vian. Il a souvent utilisé d'autres pseudonymes, parfois sous la forme d'une anagramme, pour signer une multitude d'écrits.
Boris Vian a abordé à peu près tous les genres littéraires : poésie, documents, chroniques, nouvelles. Il a aussi produit des pièces de théâtre et des scénarios pour le cinéma. Son œuvre est une mine dans laquelle on continue encore de découvrir de nouveaux manuscrits au XXIe siècle. Toutefois, sa bibliographie reste très difficile à dater avec précision, lui-même ne datant pas toujours ses manuscrits. Ainsi, Noël Arnaud dans les Vies parallèles de Boris Vian, et Claude J. Rameil qui ont fait des recherches très poussées, ne donnent pas les mêmes dates que les proches de l'auteur sur l'année de publication de certaines œuvres, notamment les Cent sonnets.
Il est également l'auteur de peintures, de dessins et de croquis, exposés pour la première fois à l'annexe de La Nouvelle Revue française en 1946. Une exposition à la Bibliothèque Nationale de France lui a été consacrée en 2011-2012.
Pendant quinze ans, il a aussi milité en faveur du jazz, qu'il a commencé à pratiquer dès 1937 au Hot Club de France. Ses chroniques, parues dans des journaux comme Combat, Jazz-hot, Arts, ont été rassemblées en 1982 : Écrits sur le jazz. Il a aussi créé quarante-huit émissions radiophoniques Jazz in Paris, dont les textes, en anglais et en français, étaient destinés à une radio new-yorkaise et dont les manuscrits ont été rassemblés en édition bilingue en 1996.

Son œuvre littéraire, peu appréciée de son vivant, est saluée par la jeunesse dès les années 1960-1970. L'Écume des jours en particulier, avec ses jeux de mots et ses personnages à clef, est passé à la postérité. Il est désormais un classique, qu'on étudie souvent dans les collèges et les lycées.[réf. souhaitée] 
« Si, au cours de sa brève existence, il a multiplié les activités les plus diverses, son nom s'inscrit aujourd'hui parmi les plus significatifs de la littérature française. »

Réputé pessimiste, Boris Vian adorait l'absurde, la fête et le jeu[interprétation personnelle]. Il est l'inventeur de mots et de systèmes parmi lesquels figurent des machines imaginaires et des mots, devenus courants de nos jours. Mais il a également élaboré des projets d'inventions véritables lorsqu'il était élève ingénieur à l'École centrale Paris. Sa machine imaginaire la plus célèbre est restée le pianocktail, instrument destiné à faire des boissons tout en se laissant porter par la musique.
Il meurt en 1959 (à 39 ans) à la suite d'un accident cardiaque survenu lors de la projection de l'adaptation cinématographique de son livre J'irai cracher sur vos tombes. Adepte d'Alfred Jarry et d'une certaine forme de surréalisme, son adhésion au Collège de 'Pataphysique, fait de lui un Satrape auquel le collège rend hommage en annonçant la mort apparente du « Transcendant Satrape »."
"Joanne Rowling [ d͡ʒoʊˈæn ˈroʊlɪŋ], plus connue sous les noms de plume J. K. Rowling et Robert Galbraith, est une romancière et scénariste anglaise née le 31 juillet 1965 dans l’agglomération de Yate, dans le sud du Gloucestershire. Elle doit sa notoriété mondiale à la série Harry Potter, dont les romans traduits en près de quatre-vingts langues ont été vendus à plus de 500 millions d'exemplaires dans le monde.
Issue d’une famille modeste, elle a écrit sa première « histoire » à l'âge de six ans. Après des études à l'université d'Exeter ainsi qu'à la Sorbonne où elle a obtenu un diplôme en littérature française et en philologie, elle a travaillé un temps au sein d'Amnesty International, puis a enseigné l'anglais et le français. C'est à vingt-cinq ans qu'elle a bâti les premiers concepts et institutions de son univers sorcier, dans lequel un enfant orphelin découvrait à la fois son héritage tragique et ses talents de magicien. Elle a rédigé son premier roman, L'École des sorciers, dans un contexte de précarité et de dépression et a dû attendre plus d'un an avant sa publication en 1997 chez Bloomsbury.
Acclamée par ses lecteurs de tout âge et par la critique, J. K. Rowling a remporté de nombreux prix littéraires, notamment les prix Hugo, Locus et Bram Stoker, et a reçu la croix de chevalier de la Légion d'honneur en 2009. Mère de trois enfants, elle est réputée pour aborder des idées et des thèmes profonds avec accessibilité et humour, et s'attacher régulièrement à des personnages placés en marge de la société. Time Magazine l'a élue vice-championne du titre de la Personnalité de l'année en 2007, relevant l'inspiration sociale, morale et politique qu'elle aurait insufflée à ses fans. En octobre 2010, elle a également été nommée « Femme la plus influente de Grande-Bretagne » par les principaux éditeurs de magazines.
Le succès planétaire de son heptalogie romanesque, des films adaptés ainsi que des travaux dérivés de Harry Potter lui ont permis d'acquérir une fortune considérable, dont une partie est régulièrement reversée à de nombreuses associations caritatives luttant contre la maladie et les inégalités sociales. J. K. Rowling est devenue une philanthrope reconnue en cofondant notamment l'association Lumos qui œuvre pour la protection de l'enfance.
Elle se tourne vers un public adulte à partir de 2012 en publiant le roman social Une place à prendre, puis en entamant une série policière l'année suivante, sous un second nom de plume. Elle devient également scénariste pour le cinéma à partir de 2016 en étendant son univers sorcier à travers la série de films Les Animaux fantastiques, dont le premier volet a connu un succès international."
"Charles Baudelaire est un poète français. Né à Paris le 9 avril 1821, il meurt dans la même ville le 31 août 1867.
« Dante d’une époque déchue » selon le mot de Barbey d’Aurevilly, « tourné vers le classicisme, nourri de romantisme », à la croisée entre le Parnasse et le symbolisme, chantre de la « modernité », il occupe une place considérable parmi les poètes français pour un recueil certes bref au regard de l’œuvre de son contemporain Victor Hugo (Baudelaire s’ouvrit à son éditeur de sa crainte que son volume ne ressemblât trop à une plaquette…), mais qu’il aura façonné sa vie durant : Les Fleurs du mal.
Au cœur des débats sur la fonction de la littérature de son époque, Baudelaire détache la poésie de la morale, la proclame tout entière destinée au Beau et non à la Vérité. Comme le suggère le titre de son recueil, il a tenté de tisser des liens entre le mal et la beauté, le bonheur fugitif et l’idéal inaccessible (À une Passante), la violence et la volupté (Une martyre), mais aussi entre le poète et son lecteur (« Hypocrite lecteur, mon semblable, mon frère ») et même entre les artistes à travers les âges (Les Phares). Outre des poèmes graves (Semper Eadem) ou scandaleux (Delphine et Hippolyte), il a exprimé la mélancolie (Mœsta et errabunda), l’horreur (Une charogne) et l’envie d’ailleurs (L’Invitation au voyage) à travers l’exotisme."
"Anna Gavalda est une femme de lettres française, née le 9 décembre 1970 à Boulogne-Billancourt."
"Joanne Rowling [ d͡ʒoʊˈæn ˈroʊlɪŋ], plus connue sous les noms de plume J. K. Rowling et Robert Galbraith, est une romancière et scénariste anglaise née le 31 juillet 1965 dans l’agglomération de Yate, dans le sud du Gloucestershire. Elle doit sa notoriété mondiale à la série Harry Potter, dont les romans traduits en près de quatre-vingts langues ont été vendus à plus de 500 millions d'exemplaires dans le monde.
Issue d’une famille modeste, elle a écrit sa première « histoire » à l'âge de six ans. Après des études à l'université d'Exeter ainsi qu'à la Sorbonne où elle a obtenu un diplôme en littérature française et en philologie, elle a travaillé un temps au sein d'Amnesty International, puis a enseigné l'anglais et le français. C'est à vingt-cinq ans qu'elle a bâti les premiers concepts et institutions de son univers sorcier, dans lequel un enfant orphelin découvrait à la fois son héritage tragique et ses talents de magicien. Elle a rédigé son premier roman, L'École des sorciers, dans un contexte de précarité et de dépression et a dû attendre plus d'un an avant sa publication en 1997 chez Bloomsbury.
Acclamée par ses lecteurs de tout âge et par la critique, J. K. Rowling a remporté de nombreux prix littéraires, notamment les prix Hugo, Locus et Bram Stoker, et a reçu la croix de chevalier de la Légion d'honneur en 2009. Mère de trois enfants, elle est réputée pour aborder des idées et des thèmes profonds avec accessibilité et humour, et s'attacher régulièrement à des personnages placés en marge de la société. Time Magazine l'a élue vice-championne du titre de la Personnalité de l'année en 2007, relevant l'inspiration sociale, morale et politique qu'elle aurait insufflée à ses fans. En octobre 2010, elle a également été nommée « Femme la plus influente de Grande-Bretagne » par les principaux éditeurs de magazines.
Le succès planétaire de son heptalogie romanesque, des films adaptés ainsi que des travaux dérivés de Harry Potter lui ont permis d'acquérir une fortune considérable, dont une partie est régulièrement reversée à de nombreuses associations caritatives luttant contre la maladie et les inégalités sociales. J. K. Rowling est devenue une philanthrope reconnue en cofondant notamment l'association Lumos qui œuvre pour la protection de l'enfance.
Elle se tourne vers un public adulte à partir de 2012 en publiant le roman social Une place à prendre, puis en entamant une série policière l'année suivante, sous un second nom de plume. Elle devient également scénariste pour le cinéma à partir de 2016 en étendant son univers sorcier à travers la série de films Les Animaux fantastiques, dont le premier volet a connu un succès international."
"Joanne Rowling [ d͡ʒoʊˈæn ˈroʊlɪŋ], plus connue sous les noms de plume J. K. Rowling et Robert Galbraith, est une romancière et scénariste anglaise née le 31 juillet 1965 dans l’agglomération de Yate, dans le sud du Gloucestershire. Elle doit sa notoriété mondiale à la série Harry Potter, dont les romans traduits en près de quatre-vingts langues ont été vendus à plus de 500 millions d'exemplaires dans le monde.
Issue d’une famille modeste, elle a écrit sa première « histoire » à l'âge de six ans. Après des études à l'université d'Exeter ainsi qu'à la Sorbonne où elle a obtenu un diplôme en littérature française et en philologie, elle a travaillé un temps au sein d'Amnesty International, puis a enseigné l'anglais et le français. C'est à vingt-cinq ans qu'elle a bâti les premiers concepts et institutions de son univers sorcier, dans lequel un enfant orphelin découvrait à la fois son héritage tragique et ses talents de magicien. Elle a rédigé son premier roman, L'École des sorciers, dans un contexte de précarité et de dépression et a dû attendre plus d'un an avant sa publication en 1997 chez Bloomsbury.
Acclamée par ses lecteurs de tout âge et par la critique, J. K. Rowling a remporté de nombreux prix littéraires, notamment les prix Hugo, Locus et Bram Stoker, et a reçu la croix de chevalier de la Légion d'honneur en 2009. Mère de trois enfants, elle est réputée pour aborder des idées et des thèmes profonds avec accessibilité et humour, et s'attacher régulièrement à des personnages placés en marge de la société. Time Magazine l'a élue vice-championne du titre de la Personnalité de l'année en 2007, relevant l'inspiration sociale, morale et politique qu'elle aurait insufflée à ses fans. En octobre 2010, elle a également été nommée « Femme la plus influente de Grande-Bretagne » par les principaux éditeurs de magazines.
Le succès planétaire de son heptalogie romanesque, des films adaptés ainsi que des travaux dérivés de Harry Potter lui ont permis d'acquérir une fortune considérable, dont une partie est régulièrement reversée à de nombreuses associations caritatives luttant contre la maladie et les inégalités sociales. J. K. Rowling est devenue une philanthrope reconnue en cofondant notamment l'association Lumos qui œuvre pour la protection de l'enfance.
Elle se tourne vers un public adulte à partir de 2012 en publiant le roman social Une place à prendre, puis en entamant une série policière l'année suivante, sous un second nom de plume. Elle devient également scénariste pour le cinéma à partir de 2016 en étendant son univers sorcier à travers la série de films Les Animaux fantastiques, dont le premier volet a connu un succès international."
"François-Marie Arouet, dit Voltaire, né le 21 novembre 1694 à Paris et mort dans la même ville le 30 mai 1778 (à 83 ans), est un écrivain et philosophe français qui a marqué le XVIIIe siècle.
Représentant le plus connu de la philosophie des Lumières, anglomane, féru d'arts et de sciences, personnage protéiforme et complexe, non dénué de contradictions, Voltaire domine son époque par la durée de sa vie, l'ampleur de sa production littéraire et la variété des combats politiques qu'il a menés. Son influence est décisive sur la bourgeoisie libérale avant la Révolution française et pendant le début du XIXe siècle.
Anticlérical mais déiste, il dénonce dans son Dictionnaire philosophique le fanatisme religieux de son époque. Sur le plan politique, il est en faveur d’une monarchie modérée et libérale, éclairée par les « philosophes ». Mettant sa notoriété au service des victimes de l’intolérance religieuse ou de l’arbitraire, il prend position dans des affaires qu’il a rendues célèbres : Jean Calas, Pierre-Paul Sirven, chevalier de La Barre et comte de Lally.
Son œuvre littéraire est riche et variée : son importante production théâtrale, ses longs poèmes épiques, telle La Henriade, et ses œuvres historiques firent de lui l’un des écrivains français les plus célèbres au XVIIIe siècle. Son œuvre comprend aussi des contes, notamment Candide ou l'Optimisme, des Lettres philosophiques, le Dictionnaire philosophique et une correspondance monumentale dont nous connaissons plus de 15 000 lettres sur un total parfois estimé à 40 000.
Titulaire d'une charge officielle d'historiographe du roi, il a publié Le siècle de Louis XIV, puis Le Siècle de Louis XV, ouvrages considérés comme les premiers essais historiques modernes. Il a traduit librement La Science nouvelle de Jean-Baptiste Vico en lui donnant pour titre l'expression inédite de Philosophie de l'histoire, ce qui fait de lui le précurseur du déterminisme historique au XIXe siècle, puis de l'histoire culturelle au XXe siècle. 
Tout au long de sa vie, Voltaire fréquente les Grands et courtise les monarques, sans dissimuler son dédain pour le peuple, mais il est aussi en butte aux interventions du pouvoir, qui l’embastille et le contraint à l’exil en Angleterre ou loin de Paris. En 1749, après la mort d’Émilie du Châtelet, avec laquelle il a entretenu une liaison houleuse pendant quinze ans, il part pour la cour de Prusse mais, déçu dans ses espoirs de jouer un grand rôle auprès de Frédéric II à Berlin, il se brouille avec lui après trois ans et quitte Berlin en 1753. Il se réfugie un peu plus tard aux Délices, près de Genève, avant d’acquérir en 1759 un domaine à Ferney, sur la frontière franco-genevoise, à l’abri des puissants. Il ne reviendra à Paris qu’en 1778, ovationné par le peuple après une absence de près de vingt-huit ans. Il y meurt à 83 ans.
Voltaire aime le confort, les plaisirs de la table et de la conversation qu’il considère, avec le théâtre, comme l’une des formes les plus abouties de la vie en société. Soucieux de son aisance matérielle, qui garantit sa liberté et son indépendance, il acquiert une fortune considérable dans des opérations spéculatives qui préfigurent les grandes spéculations boursières sous Louis XVI et dans la vente de ses ouvrages, ce qui lui permet de s’installer en 1759 au château de Ferney et d'y vivre sur un grand pied, tenant table et porte ouvertes. Le pèlerinage à Ferney fait partie en 1770-1775 du périple de formation de l’élite européenne éclairée. Investissant ses capitaux, il fait du village misérable de Ferney une petite ville prospère. Généreux, d'humeur gaie, il est néanmoins chicanier et parfois féroce et mesquin avec ses adversaires comme Jean-Jacques Rousseau ou Crébillon.
La Révolution française voit en lui comme en Rousseau un précurseur, si bien qu'il entre au Panthéon en 1791, le deuxième après Mirabeau. À cette même période, sur l'initiative du marquis de Villette qui l'hébergeait, le « quai des Théatins » où l'écrivain habitait à Paris au moment de sa mort sera baptisé « quai Voltaire ». Célébré par la IIIe République (dès 1870, à Paris, un boulevard et une place portent son nom), il a nourri, au XIXe siècle, les passions antagonistes des adversaires et des défenseurs de la laïcité de l’État et de l’école publique, et, au-delà, de l’esprit des Lumières."
"Joanne Rowling [ d͡ʒoʊˈæn ˈroʊlɪŋ], plus connue sous les noms de plume J. K. Rowling et Robert Galbraith, est une romancière et scénariste anglaise née le 31 juillet 1965 dans l’agglomération de Yate, dans le sud du Gloucestershire. Elle doit sa notoriété mondiale à la série Harry Potter, dont les romans traduits en près de quatre-vingts langues ont été vendus à plus de 500 millions d'exemplaires dans le monde.
Issue d’une famille modeste, elle a écrit sa première « histoire » à l'âge de six ans. Après des études à l'université d'Exeter ainsi qu'à la Sorbonne où elle a obtenu un diplôme en littérature française et en philologie, elle a travaillé un temps au sein d'Amnesty International, puis a enseigné l'anglais et le français. C'est à vingt-cinq ans qu'elle a bâti les premiers concepts et institutions de son univers sorcier, dans lequel un enfant orphelin découvrait à la fois son héritage tragique et ses talents de magicien. Elle a rédigé son premier roman, L'École des sorciers, dans un contexte de précarité et de dépression et a dû attendre plus d'un an avant sa publication en 1997 chez Bloomsbury.
Acclamée par ses lecteurs de tout âge et par la critique, J. K. Rowling a remporté de nombreux prix littéraires, notamment les prix Hugo, Locus et Bram Stoker, et a reçu la croix de chevalier de la Légion d'honneur en 2009. Mère de trois enfants, elle est réputée pour aborder des idées et des thèmes profonds avec accessibilité et humour, et s'attacher régulièrement à des personnages placés en marge de la société. Time Magazine l'a élue vice-championne du titre de la Personnalité de l'année en 2007, relevant l'inspiration sociale, morale et politique qu'elle aurait insufflée à ses fans. En octobre 2010, elle a également été nommée « Femme la plus influente de Grande-Bretagne » par les principaux éditeurs de magazines.
Le succès planétaire de son heptalogie romanesque, des films adaptés ainsi que des travaux dérivés de Harry Potter lui ont permis d'acquérir une fortune considérable, dont une partie est régulièrement reversée à de nombreuses associations caritatives luttant contre la maladie et les inégalités sociales. J. K. Rowling est devenue une philanthrope reconnue en cofondant notamment l'association Lumos qui œuvre pour la protection de l'enfance.
Elle se tourne vers un public adulte à partir de 2012 en publiant le roman social Une place à prendre, puis en entamant une série policière l'année suivante, sous un second nom de plume. Elle devient également scénariste pour le cinéma à partir de 2016 en étendant son univers sorcier à travers la série de films Les Animaux fantastiques, dont le premier volet a connu un succès international."
"Marc Levy, parfois orthographié Marc Lévy (né le 16 octobre 1961 à Boulogne-Billancourt) est un romancier français, devenu célèbre dès son premier roman, Et si c'était vrai..., adapté au cinéma en 2005."
"Stieg Larsson, de son nom complet Karl Stig-Erland Larsson, né le 15 août 1954 à Skelleftehamn, dans la région de Västerbotten et mort le 9 novembre 2004 à Stockholm d'une crise cardiaque, est un journaliste et écrivain suédois connu pour son engagement contre l'extrémisme de droite et le racisme. Publiée à titre posthume entre 2005 et 2008, sa trilogie Millénium le rend mondialement célèbre."
"Henri Beyle, plus connu sous le pseudonyme de Stendhal (prononcé [stɑ̃.dal]), né le 23 janvier 1783 à Grenoble et mort d'apoplexie le 23 mars 1842 dans le 2e arrondissement de Paris, est un écrivain français, connu en particulier pour ses romans Le Rouge et le Noir et La Chartreuse de Parme.
Stendhal aurait voulu consacrer sa vie à la rêverie, à la « chasse au bonheur », aux arts et à l'amour ; bien malgré lui, il a eu une vie mouvementée. Après la mort d'une mère trop aimée, il souffre d'une enfance étouffante à Grenoble auprès d'un père qu'il méprise et d'un grand-père qu'il adore. Il trouve refuge dans la littérature avant de partir de Grenoble, en 1799, pour aller étudier à Paris. En réalité, il s'est découvert une vocation, et abandonne ses études : il veut être comic bard, il rêve d'écrire des comédies. Ses cousins Daru le forcent à entrer au ministère de la Guerre. C'est ainsi qu'il est envoyé à Milan en mai 1800. Il découvre, émerveillé, en même temps la guerre, l'Italie, l'opéra, l'amour et le bonheur. Il ne cessera de retourner en Italie entre ses missions administratives. De tempérament timide et romanesque, souffrant de l'hypocrisie de la société de son temps, il invente pour lui-même une « méthode pratique du bonheur », le beylisme.
Perdant son emploi au moment de la chute de l'Empire, il se consacre à ses passions : l'Italie, la musique, la peinture. Il écrit Vie de Haydn, Mozart et Métastase, puis Histoire de la peinture en Italie, dont il perd le premier manuscrit dans la Retraite de Russie, et Rome, Naples et Florence, journal de sensations plutôt que guide touristique. En 1819, son chagrin d'amour pour Matilde Dembowski lui fait écrire un traité, De l'amour, tentative d’analyse du sentiment amoureux, paru en 1822, dont à peine quarante exemplaires seront vendus. C'est à partir de 1827, à l'âge de quarante-quatre ans, qu'il se lance dans le roman, avec Armance, mal compris de ses contemporains ; puis c'est Le Rouge et le Noir, paru juste après la Révolution de Juillet 1830, qui lui confère une certaine notoriété, dont il ne profite pas, ayant été nommé consul à Civitavecchia par le gouvernement de Juillet. Malgré l'ennui dans lequel le plongent ses nouvelles fonctions, Stendhal ne cesse d'écrire : il commence des autobiographies (Souvenir d'égotisme, Vie de Henry Brulard) et des romans (Lucien Leuwen, Lamiel), qu'il n'achève pas. Lors de l'un de ses congés à Paris, il écrit La Chartreuse de Parme, qui suscite l'admiration d'Honoré de Balzac. Il meurt à Paris le 23 mars 1842, à la suite d'une crise d'apoplexie survenue en pleine rue quelques heures auparavant.
Ses romans de formation Le Rouge et le Noir (1830), La Chartreuse de Parme (1839) et Lucien Leuwen (inachevé) ont fait de lui, aux côtés de Balzac, Hugo, Flaubert ou Zola, un des grands représentants du roman français au XIXe siècle. Dans ses romans, caractérisés par un style économe et resserré, Stendhal cherche « la vérité, l'âpre vérité » dans le domaine psychologique, et campe essentiellement des jeunes gens aux aspirations romantiques de vitalité, de force du sentiment et de rêve de gloire."
"Stephenie Meyer, née Morgan le 24 décembre 1973 à Hartford dans le Connecticut, est une romancière américaine. Elle est l'auteur de la série Fascination (bien plus souvent nommée  par son titre original : Twilight).
Cette saga, dont le genre littéraire s'apparente à la romance fantastique, retrace l'épopée d'une humaine, Bella Swan, et d'un vampire, Edward Cullen,  qui s'aiment envers et contre tout. Elle a été vendue à plus de cent millions d'exemplaires dans plus d'une cinquantaine de pays. Meyer a été classée 49e sur la liste des cent personnes les plus influentes du Time Magazine en 2008.
Une adaptation cinématographique de Fascination est sortie aux États-Unis le 20 novembre 2008, et le 7 janvier 2009 en France. Meyer est aussi l'auteur du roman de science-fiction pour adultes Les Âmes vagabondes."
